{"payloadSchema":"volume-plan.r1","volumeIntentRef":{"artifactId":"intent:1","version":1,"payloadHash":"aaaaaaaaaaaaaaaaaaaaaaaaaaaaaaaaaaaaaaaaaaaaaaaaaaaaaaaaaaaaaaaa"},"routeVersion":1,"tasks":[],"routeInvariants":[],"requiredExitConditions":[],"capacityBudget":{"minChapters":1,"preferredChapters":10,"maxChapters":20}}
